date,mood,energy_level,stress_level,sleep_quality,activities,notes
2026-03-01,Happy,8,3,4,Exercise;Meditation,Great workout session today!
2026-03-02,Calm,6,4,4,Reading;Socializing,Spent time with friends
2026-03-03,Neutral,5,5,3,Work,Busy day at work
2026-03-04,Anxious,4,7,2,None,Feeling overwhelmed
2026-03-05,Happy,7,2,5,Exercise;Hobbies,Painting and running helped
2026-03-06,Sad,3,6,3,None,Feeling down today
2026-03-07,Calm,7,3,5,Meditation;Exercise,Productive day
2026-03-08,Excited,9,2,5,Socializing;Hobbies,Great news from work!
